{
  "version": "1.0",
  "title": "Most popular websites based on historical Tranco top-sites ranking",
  "subtitle": "2019 to 2026",
  "hook": "Explore how the most popular websites shifted in the Tranco top-sites ranking over time.",
  "setup": "This video tracks website popularity scores and rankings from 2019 through 2026.",
  "sequence": [
    {
      "atLabel": "2020",
      "text": "qq.com jumped from rank 15 up to rank 10."
    },
    {
      "atLabel": "2023",
      "text": "microsoft.com climbed from rank 8 to rank 5."
    }
  ],
  "highlights": [],
  "ending": "Google.com maintained a leading composite score throughout the years.",
  "sourcesLine": "Data: Tranco top-sites ranking"
}